<?xml version="1.0" encoding="UTF-8"?>
<!-- This file was generated by the XDS toolkit utility 'xdsMakeSchema'
     For more information about the XDS toolkit see the XDS Resources
     web page at "http://www.suddenpresence.com/xds" -->
<xs:schema xmlns:xs="http://www.w3.org/2001/XMLSchema" elementFormDefault="unqualified" attributeFormDefault="unqualified">
	<xs:complexType name="PowerUp_t" final="#all">
		<xs:sequence>
			<xs:element name="szName">
				<xs:simpleType>
					<xs:restriction base="xs:string">
						<xs:maxLength value="10"/>
					</xs:restriction>
				</xs:simpleType>
			</xs:element>
			<xs:element name="szImage">
				<xs:simpleType>
					<xs:restriction base="xs:string">
						<xs:maxLength value="16"/>
					</xs:restriction>
				</xs:simpleType>
			</xs:element>
			<xs:element name="iHealth" type="xs:byte"/>
			<xs:element name="iInvulnerability" type="xs:unsignedByte"/>
			<xs:element name="iFastMove" type="xs:unsignedByte"/>
			<xs:element name="iHighJump" type="xs:unsignedByte"/>
			<xs:element name="iStunPlayer" type="xs:unsignedByte"/>
			<xs:element name="iLifeUp" type="xs:unsignedByte"/>
		</xs:sequence>
	</xs:complexType>
	<xs:complexType name="_xdsType1" final="#all">
		<xs:sequence minOccurs="0" maxOccurs="unbounded">
			<xs:element name="entry" type="PowerUp_t"/>
		</xs:sequence>
	</xs:complexType>
	<xs:element name="Powerups">
		<xs:complexType>
			<xs:sequence minOccurs="0" maxOccurs="unbounded">
				<xs:element name="Powerup">
					<xs:complexType>
						<xs:sequence minOccurs="0" maxOccurs="unbounded">
							<xs:group ref="_xdsGlobalElements"/>
						</xs:sequence>
					</xs:complexType>
				</xs:element>
			</xs:sequence>
		</xs:complexType>
	</xs:element>
	<xs:group name="_xdsGlobalElements">
		<xs:choice>
			<xs:element name="g_PowerUps" type="_xdsType1"/>
		</xs:choice>
	</xs:group>
</xs:schema>
