<?xml version="1.0" encoding="UTF-8"?>
<!-- Global comment  -->
<Powerups xmlns:xsi="http://www.w3.org/2001/XMLSchema-instance" xsi:noNamespaceSchemaLocation="powerups.xsd">
	<!-- Document comment  -->
	<Powerup>
		<!-- Record comment  -->
		<g_PowerUps>
			<!-- Element comment  -->
			<entry>
				<szName>Turbo Jet</szName>
				<szImage>jets.png</szImage>
				<iHealth>0</iHealth>
				<iInvulnerability>0</iInvulnerability>
				<iFastMove>30</iFastMove>
				<iHighJump>0</iHighJump>
				<iStunPlayer>0</iStunPlayer>
				<iLifeUp>0</iLifeUp>
			</entry>
			<entry>
				<szName>Jump Boot</szName>
				<szImage>boots.png</szImage>
				<iHealth>0</iHealth>
				<iInvulnerability>0</iInvulnerability>
				<iFastMove>0</iFastMove>
				<iHighJump>120</iHighJump>
				<iStunPlayer>0</iStunPlayer>
				<iLifeUp>0</iLifeUp>
			</entry>
			<entry>
				<szName>Shields</szName>
				<szImage>shield.png</szImage>
				<iHealth>0</iHealth>
				<iInvulnerability>20</iInvulnerability>
				<iFastMove>0</iFastMove>
				<iHighJump>0</iHighJump>
				<iStunPlayer>0</iStunPlayer>
				<iLifeUp>0</iLifeUp>
			</entry>
			<entry>
				<szName>Life Up</szName>
				<szImage>heart.png</szImage>
				<iHealth>0</iHealth>
				<iInvulnerability>0</iInvulnerability>
				<iFastMove>0</iFastMove>
				<iHighJump>0</iHighJump>
				<iStunPlayer>0</iStunPlayer>
				<iLifeUp>1</iLifeUp>
			</entry>
			<entry>
				<szName>Poison</szName>
				<szImage>vial.png</szImage>
				<iHealth>-20</iHealth>
				<iInvulnerability>0</iInvulnerability>
				<iFastMove>0</iFastMove>
				<iHighJump>0</iHighJump>
				<iStunPlayer>3</iStunPlayer>
				<iLifeUp>0</iLifeUp>
			</entry>
			<entry>
				<szName>Med Kit</szName>
				<szImage>medkit.png</szImage>
				<iHealth>25</iHealth>
				<iInvulnerability>0</iInvulnerability>
				<iFastMove>0</iFastMove>
				<iHighJump>0</iHighJump>
				<iStunPlayer>0</iStunPlayer>
				<iLifeUp>0</iLifeUp>
			</entry>
		</g_PowerUps>
	</Powerup>
</Powerups>
